{
  "$schema": "https://json-schema.org/draft/2020-12/schema",
  "$id": "https://schemas.driftframestudios.org/lims-eln-program-specification/v0.3.1/promotion-receipt.schema.json",
  "title": "Program Specification Promotion Receipt",
  "type": "object",
  "additionalProperties": false,
  "required": [
    "promotion_receipt_id",
    "repository",
    "target_release",
    "promotion_state",
    "evidence_mode",
    "assurance_stage",
    "candidate_coordinate",
    "release_coordinate",
    "required_evidence",
    "accountable_role",
    "metadata"
  ],
  "properties": {
    "promotion_receipt_id": {
      "const": "RCP-PROGRAM-PROMOTION-003"
    },
    "repository": {
      "const": "urn:source-key:lims-eln-program-specification"
    },
    "target_release": {
      "pattern": "^spec-v(?:0|[1-9][0-9]*)\\.(?:0|[1-9][0-9]*)\\.(?:0|[1-9][0-9]*)$",
      "type": "string"
    },
    "promotion_state": {
      "enum": [
        "candidate_pending",
        "released"
      ]
    },
    "evidence_mode": {
      "enum": [
        "planned",
        "observed"
      ]
    },
    "assurance_stage": {
      "enum": [
        "specified",
        "verified",
        "qualified",
        "validated",
        "accepted"
      ]
    },
    "candidate_coordinate": {
      "$ref": "#/$defs/versionedCoordinate"
    },
    "release_coordinate": {
      "oneOf": [
        {
          "type": "null"
        },
        {
          "$ref": "#/$defs/releaseCoordinate"
        }
      ]
    },
    "required_evidence": {
      "type": "array",
      "minItems": 4,
      "uniqueItems": true,
      "items": {
        "type": "string",
        "minLength": 20
      }
    },
    "accountable_role": {
      "type": "string",
      "minLength": 3
    },
    "metadata": {
      "$ref": "#/$defs/metadata"
    }
  },
  "allOf": [
    {
      "if": {
        "properties": {
          "promotion_state": {
            "const": "candidate_pending"
          }
        }
      },
      "then": {
        "properties": {
          "evidence_mode": {
            "const": "planned"
          },
          "assurance_stage": {
            "const": "specified"
          },
          "candidate_coordinate": {
            "type": "object",
            "properties": {
              "release": {
                "pattern": "^candidate-spec-v(?:0|[1-9][0-9]*)\\.(?:0|[1-9][0-9]*)\\.(?:0|[1-9][0-9]*)$"
              },
              "commit": {
                "const": "0000000000000000000000000000000000000000"
              },
              "digest": {
                "const": "sha256:0000000000000000000000000000000000000000000000000000000000000000"
              }
            }
          },
          "release_coordinate": {
            "type": "null"
          }
        }
      }
    },
    {
      "if": {
        "properties": {
          "promotion_state": {
            "const": "released"
          }
        }
      },
      "then": {
        "properties": {
          "evidence_mode": {
            "const": "observed"
          },
          "assurance_stage": {
            "enum": [
              "verified",
              "qualified",
              "validated",
              "accepted"
            ]
          },
          "release_coordinate": {
            "$ref": "#/$defs/releaseCoordinate"
          }
        }
      }
    }
  ],
  "$defs": {
    "versionedCoordinate": {
      "type": "object",
      "additionalProperties": false,
      "required": [
        "release",
        "commit",
        "digest"
      ],
      "properties": {
        "release": {
          "type": "string",
          "minLength": 1
        },
        "commit": {
          "type": "string",
          "pattern": "^[a-f0-9]{40}$"
        },
        "digest": {
          "type": "string",
          "pattern": "^sha256:[a-f0-9]{64}$"
        }
      }
    },
    "releaseCoordinate": {
      "type": "object",
      "additionalProperties": false,
      "required": [
        "tag",
        "commit",
        "digest",
        "promoted_at",
        "check_contexts",
        "ruleset_receipt",
        "codeowner_resolution"
      ],
      "properties": {
        "tag": {
          "type": "string",
          "pattern": "^spec-v(?:0|[1-9][0-9]*)\\.(?:0|[1-9][0-9]*)\\.(?:0|[1-9][0-9]*)$"
        },
        "commit": {
          "type": "string",
          "pattern": "^(?!0{40}$)[a-f0-9]{40}$"
        },
        "digest": {
          "type": "string",
          "pattern": "^sha256:(?!0{64}$)[a-f0-9]{64}$"
        },
        "promoted_at": {
          "type": "string",
          "format": "date-time"
        },
        "check_contexts": {
          "type": "array",
          "minItems": 0,
          "uniqueItems": true,
          "items": {
            "enum": [
              "program-validation"
            ]
          }
        },
        "ruleset_receipt": {
          "type": "string",
          "pattern": "^(?:governed|evidence)://[a-z0-9][a-z0-9._/-]*$"
        },
        "codeowner_resolution": {
          "type": "string",
          "pattern": "^(?:governed|evidence)://[a-z0-9][a-z0-9._/-]*$"
        }
      }
    },
    "metadata": {
      "type": "object",
      "additionalProperties": false,
      "required": [
        "schema_version",
        "created_at",
        "updated_at",
        "owner"
      ],
      "properties": {
        "schema_version": {
          "const": "1.0.0"
        },
        "created_at": {
          "type": "string",
          "format": "date-time"
        },
        "updated_at": {
          "type": "string",
          "format": "date-time"
        },
        "owner": {
          "type": "object",
          "additionalProperties": false,
          "required": [
            "actor_id",
            "display_name",
            "role"
          ],
          "properties": {
            "actor_id": {
              "type": "string",
              "minLength": 3
            },
            "display_name": {
              "type": "string",
              "minLength": 3
            },
            "role": {
              "type": "string",
              "minLength": 3
            }
          }
        }
      }
    }
  }
}
