{
  "promotion_receipt_id": "RCP-PROGRAM-PROMOTION-003",
  "repository": "urn:source-key:lims-eln-program-specification",
  "target_release": "spec-v0.3.1",
  "promotion_state": "candidate_pending",
  "evidence_mode": "planned",
  "assurance_stage": "specified",
  "candidate_coordinate": {
    "release": "candidate-spec-v0.3.1",
    "commit": "0000000000000000000000000000000000000000",
    "digest": "sha256:0000000000000000000000000000000000000000000000000000000000000000"
  },
  "release_coordinate": null,
  "required_evidence": [
    "The release branch reaches main through protected pull-request review with one approval, CODEOWNER review, last-push approval, resolved review threads, and protected history.",
    "The local program, language, secret-shape, schema-generation, and unit-test proofs pass at the candidate coordinate.",
    "The canonical specification tag resolves to the promoted commit and signed-tag evidence.",
    "Every constellation coordinate carries a pinned commit and tree digest from its protected release.",
    "The governance schema suite and cross-repository canonical closure comparison pass against pinned sources."
  ],
  "accountable_role": "Program release steward",
  "metadata": {
    "schema_version": "1.0.0",
    "created_at": "2026-07-28T21:00:00Z",
    "updated_at": "2026-07-28T21:00:00Z",
    "owner": {
      "actor_id": "OWNER-PROGRAM-PROMOTION-003",
      "display_name": "LIMS/ELN program release stewardship role",
      "role": "Promotion receipt owner"
    }
  }
}
